{
  "schemaVersion": "2.0.0",
  "mappingId": "VEM-TOYOTA-HILUX-AN130-ZA-2GD-6MT",
  "catalogReleaseId": "CAT-DEVELOPMENT-HILUX-V2",
  "fitmentId": "FIT-DEMO-ZA-HILUX-AN130-2020-2GD-6MT",
  "visualFamilyId": "VF-TOYOTA-HILUX-AN130-DC-FL",
  "vehicleContext": {
    "makerSlug": "toyota",
    "catalogFamilyId": "CF-TOYOTA-HILUX-AN120-AN130",
    "familySlug": "hilux-an120-an130",
    "variantId": "CV-TOYOTA-HILUX-AN130-DC-2GD-6MT",
    "variantSlug": "hilux-an130-double-cab-2gd-6mt",
    "chassisCodes": [
      "GUN125",
      "GUN126"
    ],
    "engineCodes": [
      "2GD-FTV"
    ],
    "market": "ZA",
    "attributes": {
      "bodyStyle": "double-cab",
      "transmission": "six-speed-manual",
      "drive": "4x4",
      "visualPhase": "2020-facelift"
    }
  },
  "categories": [
    {
      "visualCategoryId": "VC-ENG",
      "componentFamilyId": "VCF-ENGINE",
      "label": "Engine",
      "target": {
        "sectionSlug": "engine",
        "groupId": "GRP-HILUX-ENGINE-MECHANICAL",
        "groupSlug": "engine-mechanical",
        "defaultDiagramId": "DGM-HILUX-ENG-001",
        "fallbackQuery": "engine",
        "selectionMode": "GROUP",
        "minimumReadiness": "BROWSE_READY"
      }
    },
    {
      "visualCategoryId": "VC-TRN",
      "componentFamilyId": "VCF-TRANSMISSION",
      "label": "Transmission",
      "target": {
        "sectionSlug": "transmission-drivetrain",
        "groupId": "GRP-HILUX-TRANSMISSION",
        "groupSlug": "transmission",
        "defaultDiagramId": "DGM-HILUX-TRN-001",
        "fallbackQuery": "transmission",
        "selectionMode": "GROUP",
        "minimumReadiness": "BROWSE_READY"
      }
    },
    {
      "visualCategoryId": "VC-FBRK",
      "componentFamilyId": "VCF-FRONT-BRAKES",
      "label": "Front brakes",
      "target": {
        "sectionSlug": "chassis-systems",
        "groupId": "GRP-HILUX-FRONT-BRAKES",
        "groupSlug": "front-brakes",
        "defaultDiagramId": "DGM-HILUX-CHS-001",
        "fallbackQuery": "front brake",
        "selectionMode": "GROUP",
        "minimumReadiness": "BROWSE_READY"
      }
    },
    {
      "visualCategoryId": "VC-RBRK",
      "componentFamilyId": "VCF-REAR-BRAKES",
      "label": "Rear brakes",
      "target": {
        "sectionSlug": "chassis-systems",
        "groupId": "GRP-HILUX-REAR-BRAKES",
        "groupSlug": "rear-brakes",
        "defaultDiagramId": "DGM-HILUX-CHS-002",
        "fallbackQuery": "rear brake",
        "selectionMode": "GROUP",
        "minimumReadiness": "BROWSE_READY"
      }
    },
    {
      "visualCategoryId": "VC-FSUS",
      "componentFamilyId": "VCF-FRONT-SUSPENSION",
      "label": "Front suspension",
      "target": {
        "sectionSlug": "chassis-systems",
        "groupId": "GRP-HILUX-FRONT-SUSPENSION",
        "groupSlug": "front-suspension",
        "defaultDiagramId": "DGM-HILUX-CHS-003",
        "fallbackQuery": "front suspension",
        "selectionMode": "GROUP",
        "minimumReadiness": "BROWSE_READY"
      }
    },
    {
      "visualCategoryId": "VC-RSUS",
      "componentFamilyId": "VCF-REAR-SUSPENSION",
      "label": "Rear suspension",
      "target": {
        "sectionSlug": "chassis-systems",
        "groupId": "GRP-HILUX-REAR-SUSPENSION",
        "groupSlug": "rear-suspension",
        "defaultDiagramId": "DGM-HILUX-CHS-004",
        "fallbackQuery": "rear suspension",
        "selectionMode": "GROUP",
        "minimumReadiness": "BROWSE_READY"
      }
    },
    {
      "visualCategoryId": "VC-BODY",
      "componentFamilyId": "VCF-BODY-EXTERIOR",
      "label": "Body & exterior",
      "target": {
        "sectionSlug": "body-exterior",
        "groupId": null,
        "groupSlug": null,
        "defaultDiagramId": null,
        "fallbackQuery": "body exterior",
        "selectionMode": "SECTION",
        "minimumReadiness": "BROWSE_READY"
      }
    }
  ],
  "componentFamilies": [
    {
      "componentFamilyId": "VCF-BODY-FRONT-BUMPER",
      "visualCategoryId": "VC-BODY",
      "label": "Front bumper",
      "aliases": [
        "front bumper",
        "bumper cover",
        "bumper reinforcement"
      ],
      "target": {
        "sectionSlug": "body-exterior",
        "groupId": "GRP-HILUX-BODY-BUMPERS",
        "groupSlug": "bumpers-exterior-trim",
        "defaultDiagramId": "DGM-HILUX-BODY-001",
        "fallbackQuery": "front bumper",
        "selectionMode": "GROUP",
        "minimumReadiness": "BROWSE_READY"
      }
    },
    {
      "componentFamilyId": "VCF-BODY-HEADLAMPS",
      "visualCategoryId": "VC-BODY",
      "label": "Headlamps",
      "aliases": [
        "headlamp",
        "headlight",
        "front lamp"
      ],
      "target": {
        "sectionSlug": "body-exterior",
        "groupId": "GRP-HILUX-BODY-LAMPS",
        "groupSlug": "lamps-exterior",
        "defaultDiagramId": "DGM-HILUX-BODY-002",
        "fallbackQuery": "headlamp",
        "selectionMode": "GROUP",
        "minimumReadiness": "BROWSE_READY"
      }
    },
    {
      "componentFamilyId": "VCF-BODY-GRILLE",
      "visualCategoryId": "VC-BODY",
      "label": "Grille",
      "aliases": [
        "grille",
        "front grille",
        "radiator grille"
      ],
      "target": {
        "sectionSlug": "body-exterior",
        "groupId": "GRP-HILUX-BODY-BUMPERS",
        "groupSlug": "bumpers-exterior-trim",
        "defaultDiagramId": "DGM-HILUX-BODY-001",
        "fallbackQuery": "grille",
        "selectionMode": "GROUP",
        "minimumReadiness": "BROWSE_READY"
      }
    },
    {
      "componentFamilyId": "VCF-BODY-HOOD",
      "visualCategoryId": "VC-BODY",
      "label": "Hood",
      "aliases": [
        "hood",
        "bonnet",
        "hood latch"
      ],
      "target": {
        "sectionSlug": "body-exterior",
        "groupId": "GRP-HILUX-BODY-PANELS",
        "groupSlug": "body-panels",
        "defaultDiagramId": "DGM-HILUX-BODY-003",
        "fallbackQuery": "hood bonnet",
        "selectionMode": "GROUP",
        "minimumReadiness": "BROWSE_READY"
      }
    },
    {
      "componentFamilyId": "VCF-BODY-FENDERS",
      "visualCategoryId": "VC-BODY",
      "label": "Front fenders",
      "aliases": [
        "front fender",
        "wing",
        "wheel arch"
      ],
      "target": {
        "sectionSlug": "body-exterior",
        "groupId": "GRP-HILUX-BODY-PANELS",
        "groupSlug": "body-panels",
        "defaultDiagramId": "DGM-HILUX-BODY-003",
        "fallbackQuery": "front fender",
        "selectionMode": "GROUP",
        "minimumReadiness": "BROWSE_READY"
      }
    },
    {
      "componentFamilyId": "VCF-BODY-FRONT-DOORS",
      "visualCategoryId": "VC-BODY",
      "label": "Front doors",
      "aliases": [
        "front door",
        "door shell",
        "door handle"
      ],
      "target": {
        "sectionSlug": "body-exterior",
        "groupId": "GRP-HILUX-BODY-DOORS",
        "groupSlug": "doors-closures",
        "defaultDiagramId": "DGM-HILUX-BODY-004",
        "fallbackQuery": "front door",
        "selectionMode": "GROUP",
        "minimumReadiness": "BROWSE_READY"
      }
    },
    {
      "componentFamilyId": "VCF-BODY-REAR-DOORS",
      "visualCategoryId": "VC-BODY",
      "label": "Rear doors",
      "aliases": [
        "rear door",
        "door shell",
        "door handle"
      ],
      "target": {
        "sectionSlug": "body-exterior",
        "groupId": "GRP-HILUX-BODY-DOORS",
        "groupSlug": "doors-closures",
        "defaultDiagramId": "DGM-HILUX-BODY-004",
        "fallbackQuery": "rear door",
        "selectionMode": "GROUP",
        "minimumReadiness": "BROWSE_READY"
      }
    },
    {
      "componentFamilyId": "VCF-BODY-MIRRORS",
      "visualCategoryId": "VC-BODY",
      "label": "Door mirrors",
      "aliases": [
        "door mirror",
        "wing mirror",
        "side mirror"
      ],
      "target": {
        "sectionSlug": "body-exterior",
        "groupId": "GRP-HILUX-BODY-DOORS",
        "groupSlug": "doors-closures",
        "defaultDiagramId": "DGM-HILUX-BODY-004",
        "fallbackQuery": "door mirror",
        "selectionMode": "GROUP",
        "minimumReadiness": "BROWSE_READY"
      }
    },
    {
      "componentFamilyId": "VCF-BODY-CARGO-BED",
      "visualCategoryId": "VC-BODY",
      "label": "Cargo bed",
      "aliases": [
        "cargo bed",
        "pickup bed",
        "load box"
      ],
      "target": {
        "sectionSlug": "body-exterior",
        "groupId": "GRP-HILUX-BODY-CARGO",
        "groupSlug": "cargo-bed-tailgate",
        "defaultDiagramId": "DGM-HILUX-BODY-005",
        "fallbackQuery": "cargo bed",
        "selectionMode": "GROUP",
        "minimumReadiness": "BROWSE_READY"
      }
    },
    {
      "componentFamilyId": "VCF-BODY-TAILGATE",
      "visualCategoryId": "VC-BODY",
      "label": "Tailgate",
      "aliases": [
        "tailgate",
        "tail gate",
        "rear gate"
      ],
      "target": {
        "sectionSlug": "body-exterior",
        "groupId": "GRP-HILUX-BODY-CARGO",
        "groupSlug": "cargo-bed-tailgate",
        "defaultDiagramId": "DGM-HILUX-BODY-005",
        "fallbackQuery": "tailgate",
        "selectionMode": "GROUP",
        "minimumReadiness": "BROWSE_READY"
      }
    },
    {
      "componentFamilyId": "VCF-BODY-REAR-BUMPER",
      "visualCategoryId": "VC-BODY",
      "label": "Rear bumper",
      "aliases": [
        "rear bumper",
        "step bumper",
        "bumper bracket"
      ],
      "target": {
        "sectionSlug": "body-exterior",
        "groupId": "GRP-HILUX-BODY-BUMPERS",
        "groupSlug": "bumpers-exterior-trim",
        "defaultDiagramId": "DGM-HILUX-BODY-001",
        "fallbackQuery": "rear bumper",
        "selectionMode": "GROUP",
        "minimumReadiness": "BROWSE_READY"
      }
    }
  ],
  "provenance": {
    "authority": "CATALOG",
    "source": "DIAL development catalog binding",
    "sourceVersion": "catalog-contract-v2",
    "confidence": 1,